title,author,uid,aid,play,coins,pts
超燃！数百位8KRAW摄影师联合摄制，10分钟带你看绝美祖国大好河山！,8KRAW_OFFICIAL,21151219,69241910,1921589,330202,6611258
新中国密码：15665，611612！,共青团中央,20165629,69162538,755380,31209,1181883
习近平为共和国勋章获得者颁授勋章,浙江共青团,384298638,69383130,840929,26900,900962
出于无聊，我统计了古代393位帝王的死因,无桥233,1760723,68992451,637587,13059,853964
【混剪/百年中国苦难斗争史】一寸山河，一寸血！（谨以此片献给先烈）,_易杯酒,274989626,66925766,127214,16672,469400
旗杆挂砖头、蒙眼走正步、贴脸比排面.....阅兵“复制粘贴”有绝招支撑,小央视频,222103174,69161001,403926,7782,451731
中国各省区vs世界各国GDP？【分钟可视化】,狸子LePtC,2654670,69480072,349247,4451,371557
新华社悄悄发了一串密码：15665611612！看的人都哭了……,广东共青团,330383888,69144325,287607,4268,368580
骁话一下：一穷二白意外频发，70年前的革命者如何成功操办开国大典,观察者网,10330740,69175775,265392,12757,363936
英雄是怎样被「侮辱」的——杨振宁的遭遇,-阿健-,18690024,67229368,164110,16081,358617
咱们袁爷爷去北京领奖啦！一身西装，超帅,厉害了我的国up主,218376518,69334092,271139,8087,311603
【睡前消息23】埃塞：工业不发达，我要建大坝 埃及：水资源匮乏，你建我就打,观视频工作室,54992199,69134291,258020,6277,287167
参观完大陆阅兵后 台媒酸了,景德镇梁朝伟,10317469,69244405,307195,18,275508
你能把玻璃砸破，我把玻璃吃了，面对印度的嘲笑，我们用事实回应...,DOG旧档案,54040,69350492,302732,58,274189
政治可以考90分？张雪峰：你爷爷肯定是个红军,努宝见闻录,470743793,67000873,230948,544,271504
世上有几人能活到这短片结束？,尽整没用的,7428971,52012946,101537,2835,267815
蔡徐坤拿了华语金曲奖？华语乐坛成为下一个唱衰对象了吗？【独树一帜27】,树根龙门阵,99336697,67479858,136810,13303,244907
袁隆平爷爷：我的经费都是秒到账,宁失于心,383824638,63390012,257933,1445,244753
【科技袁人】听说中国科学家挣钱了，我们就放心了,科技袁人,419501714,69180207,209657,3570,237661
螃蟹陷阱,野外生存天麒,437942770,69154272,283063,94,236239
人流与剖腹产手术的区别，太过于真实了！,卧龙寺,258457966,68824541,182722,1381,235514
一个人辞职后能有多开心？,西柯斯基,111654291,69157142,233538,173,230568
【普京】俄罗斯阅兵看起很叼一副要去干架的样子,什么都想做的小祥子,400685736,69240804,217969,170,229928
【经济泡沫1/4】一朵花换一栋楼？疯狂的荷兰郁金香和长春君子兰,李永乐老师官方,9458053,69184579,137294,6588,224825
20年后再来看《丑陋的中国人》，事实比文字更具说服力~,亚食人,80304,52556831,113001,9073,224097
华为Mate30 Pro 慢动作下划火柴是什么亚子？,Jaygee02,188264625,69215364,253978,104,223366
1920年的手摇手电筒的修复,油管记者sola,24235204,68926642,225256,141,219288
自制坦克双流传动,神州将军DIY工作室,385025067,69056494,209854,623,216199
一张纸真的不能对折超过7次？外国男子不信邪，搬出液压机亲测…@油兔不二字幕组,油兔不二字幕组,15967711,68899050,213380,66,202879
这船真骚,无敌扎蹄,31548754,69191074,215752,32,200615
金灿荣：我年轻的时候也特崇拜西方，现在很喜欢中华文化,金灿荣频道,452161580,69342318,166897,2180,198155
【小狼】耗时一千小时打造，魔兽世界银鳞胸甲,小狼TOWER,1110510,69315211,130760,8384,192850
张召忠说169：战斗机轰炸机傻傻分不清？看看中国歼-16有多厉害！,张召忠,33683045,69064904,166567,2880,173157
你是不是总把事情拖到最后一刻做？什么是拖延症？该如何改善呢？,我是EyeOpener,43645887,69315644,71409,6023,171903
9月23日16岁的瑞典“气候女孩”再次登上联合国气候峰会的舞台，发出极具煽情和愤怒般的演讲,射程之内皆为真理,432925927,69182150,169394,136,171150
什么是“神”,你看这个碗大又圆,13871587,69307331,104455,577,170608
绣春囊之谜 吴氏/癸酉本石头记 红楼梦结局也许找到了 红楼梦系列第8期,女王泡面,2539073,69457594,74351,13411,168593
【思维+】第一期 被进化遗忘的牙齿,思维实验室,14583962,69162317,129921,2471,163663
日本一小岛消失，海平面上升淹没日本需要多久？【好奇研究社】,好奇社长杨坨坨,272712050,69299198,123431,2665,161312
混乱or秩序，弱小or强大？ 公元1000年的世界都在干什么？【猩猿崛起15】,太阳星sunstar,11684621,69363300,93266,7166,157421
刚租的劳斯莱斯，本来想装b...结果....出车祸了,打球吗网友,350296726,68989166,172548,86,153311
【官方双语】旋转物体的表现为何如此诡异？【Veritasium真理元素】,Veritasium真理元素,94742590,68923111,77971,1428,146946
变态心理学 北京大学,BLGX,434173653,59846519,44541,753,145207
中国军人又帅出新高度！这是你从未见过的男神天团！,军粉V,27472735,68089521,56369,4337,144652
【回形针PaperClip】游戏手机到底好在哪？,回形针PaperClip,258150656,69520821,118836,1952,143394
引起极度舒适的木头浸水的声音（戴上耳机体验）,闲情减旧,275880286,66036118,61167,504,143286
日语初学者福利！全套日语五十音写法示范教学！（平假名篇）,妮酱日语小课堂,323987490,66927221,17810,873,140674
【最强技术宅？】这大概是B站最硬核的bad apple！,咩2016,22179720,63148356,63126,8528,139857
日本最神秘失踪案4岁儿童40秒人间蒸发,我是大佬K,297670584,69187566,113748,1801,139372
我竟然花2600元买了颗钛合金悠悠球？【涛哥测评】,涛哥测评,2522486,68914919,114840,2530,137818
普克卡瓦血屋谜案（中），百叶窗外射杀理论,X调查,339233162,69192707,100635,3680,134851
猫为什么爱看人上厕所？原因跟你想的不太一样！,有猫真好CatMeowGo,430376334,68927532,115562,794,131438
奔驰原厂排气声大被邻居喷胶水，该车主贴出告示称投诉人‘看别人开好车就眼红’……,白沙汽车空间,17075969,69115891,135348,14,128253
电脑CPU放大1000倍，犹如一座一线城市鸟瞰图，太美了,微观小卡,388094867,69164385,130413,107,127899
目前最有杀气的1984年大阅兵！,破译专家池步洲,37569314,26546498,105793,371,127217
古代犯罪者最爱的“蒙汗药”，其实就在你身边。【墨胎说61】,青鹿中医,27825464,69162914,106151,511,124039
鼎盛、衰落、复兴！世界各国GDP(PPP)历史排行 1660-2016,Jannchie见齐,1850091,56280445,61413,2814,120868
【70周年/燃泪混剪】带您回顾70年历史成就，每一步都值得骄傲!,言君剪辑狮,162501749,65795137,65507,3359,120039
装X神器，让女同学刮目相看！,最爱玩JP,256416366,67385939,115677,183,119055
洗澡时身上搓下来的东西是什么？显微镜100倍放大，实在震撼！,奇闻小九门,472110205,68881460,119907,23,116709
泌尿科医师的内裤指南，科普选内裤,田中人蜡笔小聪,28732643,67158858,89564,296,113212
引导员：这车不贵···官方指导价4700万！,前方高能丶丶丶,95614810,69188258,111924,9,110711
复活岛石像的秘密终于出土，原来我们看到的只是冰山一角,我是修代号X,470166713,69151390,108053,57,109880
【何同学】一看就懂！用水讲明白为什么5G更快,老师好我叫何同学,163637592,66210564,64733,5986,107954
韩国世越号沉没的真相:活人献祭为复活朴槿惠闺蜜父亲？,AbbeyLau是爱比哟,44586238,69445090,81906,2301,107309
汉朝1年之内就被瓜分，10多路诸侯讨伐董卓，只有孙坚完胜董卓【3D沙盘推演三国-8】,信息素的信息,44412187,69278372,67049,4911,107028
号称可跑400km/h的韩国产高铁“海雾430”,外形看起来很霸气,龍峴洞阿牛,20092261,69185861,107574,6,106951
这时候底盘就显得有些低了|350z,落桂子,1390863,69026808,96331,35,103392
【Photoshop 教程】史上最容易听懂的PS入门基础教程（更新完毕：多的是你不知道的事）,doyoudo,20503549,4548006,34191,806,99037
【评头论足】红衣少女的巨炮！万代 MG 炮击型扎古勇士 露娜玛利亚机 高达模型介绍,谢双超,2029306,69296445,79288,2167,98017
价值100万的“金杯”车 遭众人围观,好看不火的梦想家ALI,326088478,69054777,89937,1223,97477
本田、丰田、日产，谁的CVT更好,备胎说车,50063223,69172349,50940,4404,94622
【混乱博物馆】你的眼睛为何如此贫穷,混乱博物馆,97177641,69515908,60247,2529,93771
我们的一生，在这部短片前1分钟就结束了,黑白键伯辽兹,135398825,49146332,37193,918,93692
【空难纪录片】川航客机惊险迫降全纪实,黑暗驯兽师,69841958,23860986,69855,250,93448
【历史互动视频】上断头台还是富可敌国，98％的人第一次就选错了！回到18世纪的法国，看看你能走多远。,233历史研究所,274729325,67340172,51495,1283,91709
喂！你的手机响了！日本小哥用马林巴琴再现iPhone的手机铃声。,日本沙雕日常,324753357,69095253,69702,326,91628
【中英字幕|John Fish】尖子生的自我修养|哈佛小哥亲传7大习惯|努力不是给别人看的,-一对姐妹-,203306365,69141471,25951,340,90534
不就是踩点吗？强迫症福音！大阅兵史上最强盘点。,青年湖南,43563506,68406364,79900,282,89679
中车四方76km/h高速列车对撞实验,傻丘relic5064,1626326,69169467,91234,41,88274
国外点击率超高千万的中国军歌《当那一天来临》，歌曲响起时哭了,赤瞳霹雳,38378303,40444034,70793,637,88112
为什么大多数人永远不会真正成功？,ONE字幕组,14005706,68876841,23687,422,86890
身价1008亿的他！买车后没有驾照，交警队长竟亲自送了本荣誉驾照,靓眼科技,392172253,39033997,94717,53,86708
[学习]英语音标：让你终生难忘的几分钟！,太宇可斯,27593118,56810226,28359,451,85866
[全36集][日本大叔用中文教日语][出口仁][大家学标准日本语][初级][中级][高级][中日双字][日语入门][日语教程],表哥冲鸭,10237259,56627825,16403,654,85617
【Kurzgesagt】吃肉对你有害吗？吃肉真的不健康吗？@柚子木字幕组,柚子木字幕组,221648,69373319,68885,377,84285
没接住的那一瞬间，他连自己埋哪儿都想好了,姬家紫月,103516730,67154383,84534,47,84174
[Pr教程]0基础急速上手视频制作！UP主必备！,天JIANG,21143599,5540953,30849,916,82079
【点兵1074】中国六代机会装上新型发动机吗？歼20总师杨伟这句话让人振奋,每日点兵,34270978,69254525,77372,705,81974
白银段位的鸭子,喝酒抽烟会变胖,171703422,66448100,88990,10,81080
Pr教程全57集,贝塔珐,11646984,33803637,20113,250,81014
从语言角度看黑人抽象思维能力的缺乏,1488黑太阳,472174882,69360331,55770,257,80260
【C菌】干货！99%的玩家都拥有的心理问题，3分钟带你看透！,渗透之C君,4162287,67713703,56521,1511,79062
虾米？据说这个马德堡半球，16匹马都扯不开！,爆炸实验室bomblab,105588685,69041812,85505,11,78709
【2020考研政治】徐涛强化班马原思修史纲毛中特最全,ban1877,470622013,69119254,51772,99,78303
【完美开箱】“90后”爷爷的建国70周年纪念章,蝌蚪一文,154151436,69220756,70143,964,77954
【心理学】改变自己，只需要两年时间（T君译）,TED君学演讲,8188433,69117624,20680,328,77685
呼兰云栖大会现场吐槽程序员(一小时完整版),代码搬砖工,224429246,69095180,55740,191,77239
2015年二战胜利70周年阅兵,魏道,20441251,7690235,58414,348,77121
这是挨了多少顿毒打才练就的车技呀！,这车值么,75440072,67167245,79225,69,76524
